phantom_model_family,primitive_substrate_function,stealth_class,encryption_tier,operator_mission,ledger_integration_path,package_organism_placement
Stealth Routing,Obscure transaction propagation paths,Cloaked,Tier-2,Mask origin and timing signatures,/registry/phantom/ledger/stealth-routing,Substrate organism / transport veil layer
Encryption Weave,Encrypt payload and state proofs,Shielded,Tier-4,Protect message confidentiality and integrity,/registry/phantom/ledger/encryption-weave,Substrate organism / cryptography layer
Hash Discovery Mesh,Discover valid hashes under adaptive constraints,Adaptive,Tier-1,Optimize puzzle-space traversal,/registry/phantom/ledger/hash-discovery,Substrate organism / compute search layer
Phi-Scanned Puzzle Search,Prioritize nonce search using phi-biased heuristics,Spectral,Tier-1,Increase search efficiency under constrained power,/registry/phantom/ledger/phi-scan,Substrate organism / optimization layer
Cloak Computation,Execute proofs with concealed hardware profile,Opaque,Tier-3,Reduce miner fingerprintability,/registry/phantom/ledger/cloak-compute,Substrate organism / execution concealment layer
Multi-Algorithm Diversification,Switch hashing families by runtime policy,Polymorphic,Tier-2,Resist single-algorithm exploitation,/registry/phantom/ledger/multi-algo,Substrate organism / consensus defense layer
Decoy Traffic Injection,Inject indistinguishable cover traffic,Mimetic,Tier-2,Hide true chain activity patterns,/registry/phantom/ledger/decoy-traffic,Substrate organism / network obfuscation layer
Adaptive Key Rotation,Rotate ephemeral keys by risk trigger,Reactive,Tier-5,Limit blast radius of key exposure,/registry/phantom/ledger/key-rotation,Substrate organism / key lifecycle layer
